<listaproductos xmlns:xsi="http://www.w3.org/2001/XMLSchema-instance"
 xsi:noNamespaceSchemaLocation="./lista.xsd">
  <producto codigo="DX-22"><!--Codigo obligatorio-->
    <descripcion>Ordenador</descripcion><!--Optativa-->
    <peso>23.44</peso><!--Positivo con decimales-->
  </producto>
  <producto codigo="CX-124">
    <peso>17.50</peso>
  </producto>
  <producto codigo="CX-124">
    <peso>17.50</peso>
  </producto>
</listaproductos>